,0
8,"Report fraud Find the support you need to handle the situation. Report an unauthorized transaction If you see a charge that you do not recognize and you’ve confirmed it’s not an authorized user or recurring transaction, it may be an unauthorized transaction. You can also log in to your account to view more details about the transaction. If you do recognize the transaction but there’s a mistake with it, learn more about how to dispute your charge.
 
You may report unauthorized transactions by phone by contacting Capital One directly at the number on the back of your card, or at:
1-800-227-4825
 
If you are outside the U.S., you may call collect at:
1-804-934-2001
 
Don’t worry, you are never held responsible for unauthorized charges with $0 liability for Unauthorized Charges protection. I requested a replacement credit card. When will it be delivered? Standard delivery time for replacement cards is 4–6 business days. If you haven’t received yours within that time frame, please call us at 1-800-227-4825. What happens if someone tries to use my deactivated credit card? Your old credit card is no longer valid, so any transactions attempted with it will not be approved. As always, please continue to monitor your statement for unrecognized transactions. Will my credit card payments post to the right account if I get a new credit card number? Yes, as long as you continue making payments online, by phone or by mail, your payments will post correctly. Please also note: If you're enrolled in automatic payments through a third-party vendor, you will need to update your credit card information with them in order for your payments to occur as scheduled. If you're enrolled in Capital One AutoPay, no action is needed and your payments will occur as scheduled. If you mail your payment, you can use your old card number until you receive your new one, then begin mailing payments using your new payment coupon. What happens to recurring charges when I get a new credit card number? Your card number has changed so once you receive your new credit card, you might need to give your new account information to all merchants that store your card information to be sure your future charges are approved. To help get you started, Capital One has compiled a list of your recurring charges and other places your card may be stored on your account. Please double check to make sure these are all your recurring merchants as Capital One may not have been able to detect all of them.  (In some cases, the Visa or Mastercard networks might inform the merchant of your new card number, eliminating the need to update your card information with the merchant.) View My Recurring and Frequent Merchants What happens if a credit is applied to my old credit card number? Our systems are designed to post the credit to your new card number. I see additional unfamiliar transactions on my old credit card account—what should I do? Please give us a call at 1-800-227-4825.  (If you are outside the U.S., you may call collect at 1-804-934-2001.) An agent can add additional transactions to your fraud claim or open a new fraud claim. I reported fraud on a “virtual card number” I made with the Eno Browser Extension – what does that mean and how does it impact me? Reporting fraud on a virtual card number means that a fraudster got ahold of the virtual card number that you made in the Eno Browser. You will need to create a new virtual card number for the merchant that was compromised. You can do this by going to the merchant website on your computer and creating a new number with the Eno Google Chrome Extension. Additionally, you will need to get a new card issued.  If you are eligible you can get a new card on our website. Otherwise, contact Capital One using the number on the back of your card or at: 1-800-227-4825.  (If you are outside the U.S., you may call collect at 1-804-934-2001.) 8. Will there be any changes to my credit card account terms and/or rewards program as a result of having my credit card replaced? No, they won’t change. All of your credit card account terms, including your rewards balance, will stay the same. We will transfer your rewards balance to your new account number. 9. What else can I do to protect myself from fraud? Capital One provides a comprehensive set of features that can help you protect yourself from fraud: Add your mobile number to receive 2-Way Text Alerts—If we detect potentially suspicious activity on your account we’ll send a text. You can reply in the moment to stop fraudulent activity. Add my number. Use Card Lock – Lock your card with just a few taps from the Capital One Mobile app to try to prevent any unauthorized charges if your card is misplaced, lost, or stolen. Check it out. Go incognito. Shop online with virtual card numbers and keep your actual card number to yourself. Check it out. Sign Up for Instant Purchase Notifications – Receive a push notification on your phone each time a new purchase is approved on your account, so you can spot unauthorized charges the moment they happen. Sign Up. Enroll in Paperless – Enroll in paperless settings to prevent your personal information being stolen from or en route to your mailbox. Enroll in Paperless. CreditWise® from Capital One—Keep a close eye on your credit report and receive alerts anytime a new credit line is opened in your name (and reported to TransUnion or Experian. Also, now enjoy free Social Security number dark web monitoring. Sign Up. If you believe you've been the victim of a scam - report the scam to the BBB Scam Tracker and the government via the FTC ReportFraud site. You may also want to report scammers directly to the FBI."
9,"How to use your travel credits Learn how to use your travel credits for new bookings through Capital One Travel. Travel credits are a form of payment issued by Capital One that you may apply to future purchases on Capital One Travel. Travel credits are issued in specific scenarios, such as when you receive our price drop protection or our price match guarantee.   You can apply that travel credit to pay for a new booking directly through Capital One Travel. Not sure if you have travel credits available? Follow these steps any time to check your balance. 1. Sign in to Capital One Travel, and click the menu button in the top right-hand corner. 2. Select My travel credits and offers. 3. View travel credits available to spend on travel. 4. Click View activity to see your travel credit activity 5. View detailed breakdown of all Travel Credit balance(s) and transactions Need more help? Check out all Capital One Travel help topics or give us a call at 844-422-6922.  What are airline travel credits, and how are they different from Capital One travel credits? When you cancel a flight, the airline might issue a travel credit. You can often apply that airline credit to pay for a new booking directly through Capital One Travel. To see if you have available airline travel credits, sign into Capital One Travel and go to the My Trips page. Keep in mind that Capital One Travel is bound by the airline’s rules and restrictions and can only redeem airline travel credits according to the terms and conditions of the airline. Here are a few things to be aware of: If you booked with a low-cost carrier—like Spirit Airlines or Ryanair—the booking is managed by the airline. Contact the airline directly for more information about possible travel credits. Airline travel credits typically aren’t offered for basic economy bookings. Airline travel credits might expire after a certain period of time, according to the rules set by the airline. The airline credit can only be used by the same passengers on the same airline as the original booking. The airline credit might not be able to be applied to certain flights.  By contrast, Capital One travel credits are a form of payment issued by Capital One that you may apply to future purchases on Capital One Travel. Do travel credits expire? Some travel credits issued through Capital One Travel don’t have an expiration date, including those issued in connection with Price Drop Protection1 or Price Match Guarantee2. The $300 annual travel credit issued to Venture X and Venture X Business cardholders expires on the next account open-date anniversary.  To view more details about your travel credits, sign in to Capital One Travel and go to the My travel credits and offers page and select View activity. Can someone else use my travel credits?  No, only the customer issued the travel credit can use it. Can I use a travel credit on more than one booking? Yes, depending on the amount of your travel credit, you may be able to use it on multiple bookings. For example, if your travel credit is worth more than the total cost of a trip you’re booking, you will keep any remaining travel credit balance to use later. Alternatively, if your travel credit is worth less than the total cost of your booking, you’ll need to use your eligible Capital One credit card or Capital One rewards to pay the remaining balance. Support | Short Read Learn how to cancel your flight booked through Capital One Travel and how travel refunds work."
10,"Late payment support Learn more about what to do when your Capital One credit card payment is late. If you find yourself making a late payment on your Capital One consumer credit card, it’s important to know what to do next.   When you miss a payment, you’ll enter collections where you may be charged late fees and interest. We typically report accounts as late to the credit bureaus after they are more than 30 days past due. For more information, review some of the top things to know about late credit card payments. Once you’re in collections, we may call you from 800-955-6600, 800-435-1514, or another servicing number. If you see a call from these numbers, that’s us reaching out to provide further assistance. Our team will explain your account status and discuss if there are any additional options available to help you through your current financial situation. Late payment FAQs Need more help with your late Capital One payment? Review answers to some of our most frequently asked questions below. If you have any additional questions about your account status, please don’t hesitate to contact us. How do I find out my due date and how much I owe? To manage your credit card payments, sign into your account. Your due date and account balance will be the first things you see at the top of the page after signing in. Will I be charged late fees or interest? If you're late making your payment, you may be charged late fees and interest.  I’m struggling to make on-time payments—can Capital One help? Capital One offers payment plans to eligible customers. Contact us to see what options may be available to you. When does Capital One report late payments to the credit bureaus? Please note that at Capital One, we typically report accounts as late to the credit bureaus after they are more than 30 days past due. For more general information, learn about how late payments can impact your credit score. To get ahead of potential changes to your credit score and credit report, use our free credit monitoring tool, CreditWise from Capital One.  Enter your card balance information to calculate your payoff results."
11,"How to freeze the price of a flight Freeze the price of a flight for a specific time to land a great deal with Capital One Travel. Here’s how. Want a little extra time before you decide to book a flight? For some flights offered through Capital One Travel, you can “freeze” the price for a specific period of time by paying a small fee. Freezing the price of a flight will give you some extra time to plan your trip—and you won’t have to stress about the price potentially going up.   When you freeze the price of the flight, Capital One Travel will hold that price for you until the expiration date of your frozen price. That expiration date will be given to you before completing your purchase. If the price of the flight increases after you freeze it (and before your frozen price expires), Capital One Travel will cover any fare increase up to the maximum amount, which will also be given to you before completing your purchase. If the price goes down, you pay the lower price. Here's how to freeze the price of a flight: 1. Sign in to Capital One Travel and search for a flight. 2. On the flight results page, select Freeze price. Or, if you prefer, select your flights first and then select Freeze this price on the Review Itinerary page (if available). 3. If you selected Freeze price from the flights results page, click Continue if you want to select the suggested flights or Choose another flight to select your own set of flights to freeze. 4. Choose the duration of your price freeze. Images of mobile experience for illustration only. User experience and fee details may vary. 5. Ensure the details are correct and then follow the on-screen instructions to complete your booking. After you purchase your price freeze, you can view your price freeze details in your confirmation email or by following these steps: 1. Sign in to Capital One Travel and click the menu button in the top right-hand corner. 2. Select My Trips. 3. Select the Frozen Prices tab to view your frozen flights and proceed to booking. If your frozen price has not expired but there aren't enough seats available when you try to book, Capital One Travel will give you the option to apply your freeze to a similar flight if available, or you can get a refund for your price freeze fee. Similar flights will have the exact same dates, origin and destination as the flight you froze. As long as your freeze hasn't expired, your original frozen price and the remaining duration of the freeze will be transferred to the similar flight you select. Capital One Travel will also cover the price difference up to the maximum service cap that was specified when you froze the price. Need more help? Check out all Capital One Travel help topics or give us a call at 844-422-6922. When do frozen prices expire? The expiration date and time are specified when you pay to freeze the price, which you can see in the Frozen Prices tab of the My Trips page any time. If you decide to book the flight after the frozen price expires, you’ll pay the airline’s current price.   What happens after I freeze a flight price? You’ll receive a confirmation email when you freeze a flight price. The email will specify your maximum refund amount as well as the expiration date and time of your frozen price. How many passengers is the price freeze valid for? The frozen price is valid only for the number of passengers you indicated when you paid to freeze the price. If you freeze the price for multiple passengers, you’ll need to book for all the passengers in order to purchase your tickets at the frozen price. For example, if you freeze the price for five passengers, you must book for all five. And if fewer than five seats are available, the flight is considered unavailable for you to book.  Can I freeze the price of a flight for a child? Due to airline contracts, Capital One Travel can’t support any bookings in which the only traveler is younger than 18 years old. This means you can’t book a frozen trip price for a minor traveling alone. Support | Short Read"
12,"Manage your rental car booking Learn how to manage your rental car bookings through Capital One Travel, including changes and cancellations. How to change your rental car reservation The easiest way to change your booking is usually to cancel and make a new reservation. Canceling and rebooking also works if you prepaid some or all of a refundable reservation.   Keep in mind that all change requests are subject to rental car availability. You may have to pay cancellation or change fees, depending on the rental car provider’s policies.  All eligible rental car refunds are sent back to the original payment method. You typically receive your refund within one or two billing cycles.  Here’s how refunds works by payment method:  Capital One rewards only: Your refund will be returned entirely as rewards.  Credit card only: Your refund will be issued back to your card account.  A combination of rewards and your credit card: You’ll be refunded in both rewards and on your credit card, proportionally to how you originally paid. Here’s an example: If your original payment was 60% on your credit card and 40% rewards, a $100 refund would be returned as $60 credit to your card and $40 worth of rewards.  Capital One travel credit: If you used a travel credit to pay for some or all of your booking, you’ll receive that same amount back in travel credit for future use. If a purchase made using an annual travel credit is canceled after the expiration date of the credit, the credit will not be restored. When to contact the rental car provider directly to request a change If you don’t want to cancel and rebook your reservation, you need to contact the rental car provider directly to request any changes. How to cancel your rental car reservation Some, but not all, rental car bookings are refundable and can be canceled through Capital One Travel. Follow the steps below to cancel your reservation. 1. Sign in to Capital One Travel and click the menu button in the top right-hand corner. 2. Select My Trips. 3. Click on your upcoming trip to view more details. 4. Select Cancel Car Rental. 5. If available, you will see an option to cancel your reservation. Since rental car cancellation policies vary, we recommend that you review your policy before canceling your reservation. You can find the cancellation policies within your booking details in My Trips or in your confirmation email under the Car Details section. Need more help? Check out all Capital One Travel help topics or give us a call at 844-422-6922."
